{
  "$comment": "Nested semantics, provider headers, and binary member limits are enforced by tools.evidence.release_controller_activation_proof.verify_exchange.",
  "$id": "https://paulkov.github.io/dpone-release-controller/schemas/wire/dpone.release-broker-activation-proof.v1.schema.json",
  "$schema": "https://json-schema.org/draft/2020-12/schema",
  "additionalProperties": false,
  "properties": {
    "activated": {
      "type": [
        "array",
        "boolean",
        "integer",
        "object",
        "string"
      ]
    },
    "admitted_at": {
      "type": [
        "array",
        "boolean",
        "integer",
        "object",
        "string"
      ]
    },
    "controller": {
      "type": [
        "array",
        "boolean",
        "integer",
        "object",
        "string"
      ]
    },
    "expires_at": {
      "type": [
        "array",
        "boolean",
        "integer",
        "object",
        "string"
      ]
    },
    "proof_sha256": {
      "type": [
        "array",
        "boolean",
        "integer",
        "object",
        "string"
      ]
    },
    "provisioned": {
      "type": [
        "array",
        "boolean",
        "integer",
        "object",
        "string"
      ]
    },
    "request_id": {
      "type": [
        "array",
        "boolean",
        "integer",
        "object",
        "string"
      ]
    },
    "schema": {
      "const": "dpone.release-broker-activation-proof.v1"
    },
    "schema_version": {
      "const": 1
    }
  },
  "required": [
    "activated",
    "admitted_at",
    "controller",
    "expires_at",
    "proof_sha256",
    "provisioned",
    "request_id",
    "schema",
    "schema_version"
  ],
  "type": "object"
}
