{"activated":{"controller_action_bundle_sha256":"sha256:64e0cf0f6903cde9ce3756f635e464e916d9009207f80f5a7f68ab9ccb1a3e12","controller_action_commit_sha":"9999999999999999999999999999999999999999","controller_action_metadata_blob_sha":"4f28c60b6c66cf80e6afecf7679e9c9ea64b927a","digest":"sha256:0e446a81711c79b3749f0a28af199df455ba389e1288a8d17b51ba307a948784","previous":"sha256:aa508c2187fca56f397ff75adc52b94e02f38122cdd48bd42105106e5e0f8e14","record_id":"sha256:16a36e86f6fed5d465ff332511a0ce1a863b55d364b25a7cdaa25db19abf9648","target_policy_blob_sha":"dddddddddddddddddddddddddddddddddddddddd","target_policy_commit_sha":"bbbbbbbbbbbbbbbbbbbbbbbbbbbbbbbbbbbbbbbb","target_policy_sha256":"sha256:823412d1eacb67956220e532959f0104603057c88704863ca38e7cd188fda812","worm_version_id":"b2-version-002"},"admitted_at":"2026-08-15T00:00:00Z","controller":{"default_branch_ref":"refs/heads/master","default_branch_workflow_blob_sha":"cccccccccccccccccccccccccccccccccccccccc","default_branch_workflow_observation_sha256":"sha256:ded838dbae94fc153d335a5d05ead41145c7ba1f0b4161822dad3d65910bd0d6","ref":"refs/tags/v2.0.0","ref_type":"tag","repository_id":1305993853,"run_attempt":2,"run_id":123456789,"tag_object_sha":"ffffffffffffffffffffffffffffffffffffffff","workflow_id":316322127,"workflow_ref":"PaulKov/dpone-release-controller/.github/workflows/release-controller.yml@refs/tags/v2.0.0","workflow_sha":"aaaaaaaaaaaaaaaaaaaaaaaaaaaaaaaaaaaaaaaa"},"expires_at":"2026-08-15T00:01:00Z","proof_sha256":"sha256:d2f084fd55a67131095fe49713fce9dfd7502c8f2ec4589f8da8de9dbdfd6f6f","provisioned":{"controller_action_bundle_sha256":"sha256:64e0cf0f6903cde9ce3756f635e464e916d9009207f80f5a7f68ab9ccb1a3e12","controller_action_commit_sha":"9999999999999999999999999999999999999999","controller_action_metadata_blob_sha":"4f28c60b6c66cf80e6afecf7679e9c9ea64b927a","controller_peeled_commit_sha":"aaaaaaaaaaaaaaaaaaaaaaaaaaaaaaaaaaaaaaaa","controller_ref":"refs/tags/v2.0.0","controller_ref_type":"tag","controller_tag_object_sha":"ffffffffffffffffffffffffffffffffffffffff","controller_workflow_blob_sha":"cccccccccccccccccccccccccccccccccccccccc","controller_workflow_commit_sha":"aaaaaaaaaaaaaaaaaaaaaaaaaaaaaaaaaaaaaaaa","controller_workflow_id":316322127,"digest":"sha256:12f26d1b6dbbfbbfdc1f08fd74a266672f5196ccefd2a1d94dbcb03cc461ac95","record_id":"sha256:aa508c2187fca56f397ff75adc52b94e02f38122cdd48bd42105106e5e0f8e14","worker_version_id":"worker-version-001","worm_version_id":"b2-version-001"},"request_id":"request-01HXDPONE","schema":"dpone.release-broker-activation-proof.v1","schema_version":1}